nickname,full_name,b_day,birth_place,years_active,occupation,wiki_url
Hunter Schafer,,"December 31, 1998","Trenton, New Jersey, U.S.",2017–present,"Actress, Model, Activist",https://en.wikipedia.org/wiki/Hunter_Schafer
Bretman Rock,Bretman Rock Sacayanan Laforga,"July 31, 1998","Sanchez-Mira, Cagayan, Philippines",2015–present,"Youtuber, Makeup Artist",https://en.wikipedia.org/wiki/Bretman_Rock
Vanessa Hudgens,Vanessa Anne Hudgens,"December 14, 1988","Salinas, California, U.S.",1998–present,"Actress, Singer",https://en.wikipedia.org/wiki/Vanessa_Hudgens
Kim Kardashian,Kimberly Noel Kardashian,"October 21, 1980","Los Angeles, California, U.S.",2003–present,"Socialite, Media Personality, Businesswoman",https://en.wikipedia.org/wiki/Kim_Kardashian
Harry Styles,Harry Edward Styles,1 February 1994,"Redditch, England",2010–present,"Singer, Songwriter, Actor",https://en.wikipedia.org/wiki/Harry_Styles
Paris Hilton,Paris Whitney Hilton,"February 17, 1981","New York City, U.S.",1996–present,"Media Personality, Businesswoman, Socialite, Model, Entertainer",https://en.wikipedia.org/wiki/Paris_Hilton
Kendall Jenner,Kendall Nicole Jenner,"November 3, 1995","Los Angeles, California, U.S.",2007–present,"Model, Media Personality, Socialite",https://en.wikipedia.org/wiki/Kendall_Jenner
